{"assumptions":["common_reference"],"baseline":{"kind":"explicit","label":"generated","price":"110000"},"checks_not_performed":["LIVE_EXECUTION","PATH_RISK"],"comparisons":{"no_hedge":{"failing_intervals":[{"lower":"60000","lower_inclusive":true,"upper":"106000","upper_inclusive":false}],"proposal_better":[{"lower":"75908","lower_inclusive":false,"upper":"90000","upper_inclusive":true}],"proposal_worse":[{"lower":"60000","lower_inclusive":true,"upper":"75908","upper_inclusive":true},{"lower":"90000","lower_inclusive":false,"upper":"110000","upper_inclusive":true}],"worst_case":{"pnl":"-12500","price":"60000"}},"smallest_reduction":{"keep_quantity":"0.02","proposal_better":[],"proposal_worse":[{"lower":"60000","lower_inclusive":true,"upper":"110000","upper_inclusive":true}],"sell_at":"110000","sell_quantity":"0.23","worst_case":{"pnl":"-1000","price":"60000"}}},"cost":{"breakevens":[],"other_costs":"25","pnl_at_baseline":"-343.5","premium":"1242.5"},"engine_version":"reference-oracle-3","evaluation_scope":"exhaustive_supported_terminal_model","execution_readiness":"not_evaluated","failing_intervals":[{"clause":"clause_0","lower":"60000","lower_inclusive":true,"upper":"107374","upper_inclusive":false,"witness":{"adverse_states":[{"leg":"leg-0","rule":"horizon_mismatch","state":"the leg's own observation pays zero"}],"pnl":"-12843.5","price":"60000"}},{"clause":"clause_1","lower":"60000","lower_inclusive":true,"upper":"107374","upper_inclusive":false,"witness":{"adverse_states":[{"leg":"leg-0","rule":"horizon_mismatch","state":"the leg's own observation pays zero"}],"pnl":"-12843.5","price":"60000"}}],"ir_digest":"cef43b41fe1f6b20e09547e906b701b16fcf36c1a1fad59caa427af1bf4770ec","leg_observation_times":["2026-09-20T06:00:00Z","2026-09-19T06:00:00Z","2026-09-19T06:00:00Z","2026-09-19T06:00:00Z"],"model_result":"fails","objective_valuation_time":"2026-09-19T06:00:00Z","profile":[{"intercept":"-27843.5","lower":"60000","lower_inclusive":true,"slope":"0.25","upper":"75908","upper_inclusive":true},{"intercept":"-26919.5","lower":"75908","lower_inclusive":false,"slope":"0.25","upper":"90000","upper_inclusive":true},{"intercept":"-27843.5","lower":"90000","lower_inclusive":false,"slope":"0.25","upper":"110000","upper_inclusive":true}],"reason_codes":["LEG_WORST_CASED_HORIZON","LOSS_BOUND_EXCEEDED"],"reductions":[{"leg":"leg-0","reason_code":"LEG_WORST_CASED_HORIZON","rule":"horizon_mismatch","tight":true}],"schema_version":"1","size_windows":[{"binding":[{"price":"60000","side":"at"}],"leg":"leg-3","status":"empty"}],"snapshots":["aaaaaaaaaaaaaaaaaaaaaaaaaaaaaaaaaaaaaaaaaaaaaaaaaaaaaaaaaaaaaaaa"],"units":{"exposure":"BTC","money":"USDC","price":"USDC per BTC","size":"contracts"},"upper_profile":[{"intercept":"-27743.5","lower":"60000","lower_inclusive":true,"slope":"0.25","upper":"75908","upper_inclusive":true},{"intercept":"-26819.5","lower":"75908","lower_inclusive":false,"slope":"0.25","upper":"90000","upper_inclusive":true},{"intercept":"-27743.5","lower":"90000","lower_inclusive":false,"slope":"0.25","upper":"110000","upper_inclusive":true}],"worst_case":{"attained":true,"pnl":"-12843.5","price":"60000"}}
