{"assumptions":["common_reference"],"baseline":{"kind":"explicit","label":"generated","price":"65000"},"checks_not_performed":["LIVE_EXECUTION","PATH_RISK"],"comparisons":{"no_hedge":{"failing_intervals":[],"proposal_better":[{"lower":"60000","lower_inclusive":true,"upper":"105000","upper_inclusive":true}],"proposal_worse":[{"lower":"105000","lower_inclusive":false,"upper":"110000","upper_inclusive":true}],"worst_case":{"pnl":"-1250","price":"60000"}},"smallest_reduction":{"keep_quantity":"0.25","proposal_better":[{"lower":"60000","lower_inclusive":true,"upper":"105000","upper_inclusive":true}],"proposal_worse":[{"lower":"105000","lower_inclusive":false,"upper":"110000","upper_inclusive":true}],"sell_at":"65000","sell_quantity":"0","worst_case":{"pnl":"-1250","price":"60000"}}},"cost":{"breakevens":["64997.5"],"other_costs":"0","pnl_at_baseline":"0.625","premium":"0.375"},"engine_version":"reference-oracle-3","evaluation_scope":"exhaustive_supported_terminal_model","execution_readiness":"not_evaluated","failing_intervals":[],"ir_digest":"bc67cd01f799aa8665221810865c35b28cdaf2806327ec90084a057902ef5608","leg_observation_times":["2026-09-20T06:00:00Z","2026-09-19T06:00:00Z","2026-09-20T06:00:00Z"],"model_result":"passes","objective_valuation_time":"2026-09-19T06:00:00Z","profile":[{"intercept":"-16249.375","lower":"60000","lower_inclusive":true,"slope":"0.25","upper":"105000","upper_inclusive":true},{"intercept":"-16250.375","lower":"105000","lower_inclusive":false,"slope":"0.25","upper":"110000","upper_inclusive":true}],"reason_codes":["LEG_WORST_CASED_HORIZON"],"reductions":[{"leg":"leg-0","reason_code":"LEG_WORST_CASED_HORIZON","rule":"horizon_mismatch","tight":true},{"leg":"leg-2","reason_code":"LEG_WORST_CASED_HORIZON","rule":"horizon_mismatch","tight":true}],"schema_version":"1","snapshots":["aaaaaaaaaaaaaaaaaaaaaaaaaaaaaaaaaaaaaaaaaaaaaaaaaaaaaaaaaaaaaaaa"],"units":{"exposure":"BTC","money":"USDC","price":"USDC per BTC","size":"contracts"},"upper_profile":[{"intercept":"-16249.375","lower":"60000","lower_inclusive":true,"slope":"0.25","upper":"105000","upper_inclusive":true},{"intercept":"-16250.375","lower":"105000","lower_inclusive":false,"slope":"0.25","upper":"110000","upper_inclusive":true}],"worst_case":{"attained":true,"pnl":"-1249.375","price":"60000"}}
