{"assumptions":["common_reference"],"baseline":{"kind":"explicit","label":"generated","price":"105000"},"checks_not_performed":["LIVE_EXECUTION","PATH_RISK"],"comparisons":{"no_hedge":{"failing_intervals":[],"proposal_better":[{"lower":"60000","lower_inclusive":true,"upper":"77457","upper_inclusive":true}],"proposal_worse":[{"lower":"77457","lower_inclusive":false,"upper":"110000","upper_inclusive":true}],"worst_case":{"pnl":"-4500","price":"60000"}},"smallest_reduction":{"keep_quantity":"0.1","proposal_better":[{"lower":"60000","lower_inclusive":true,"upper":"77457","upper_inclusive":true}],"proposal_worse":[{"lower":"77457","lower_inclusive":false,"upper":"110000","upper_inclusive":true}],"sell_at":"105000","sell_quantity":"0","worst_case":{"pnl":"-4500","price":"60000"}}},"cost":{"breakevens":[],"other_costs":"5","pnl_at_baseline":"-1237.875","premium":"1232.875"},"engine_version":"reference-oracle-3","evaluation_scope":"exhaustive_supported_terminal_model","execution_readiness":"not_evaluated","failing_intervals":[],"ir_digest":"ba9cad707134fbf811a5bd19c6d79fc7ef939db49dd03b4143e1dee52f73a135","leg_observation_times":["2026-09-19T06:00:00Z","2026-09-19T06:00:00Z"],"model_result":"passes","objective_valuation_time":"2026-09-19T06:00:00Z","profile":[{"intercept":"-10328.875","lower":"60000","lower_inclusive":true,"slope":"0.1","upper":"77457","upper_inclusive":true},{"intercept":"-11737.875","lower":"77457","lower_inclusive":false,"slope":"0.1","upper":"110000","upper_inclusive":true}],"reason_codes":[],"schema_version":"1","snapshots":[],"units":{"exposure":"BTC","money":"USDC","price":"USDC per BTC","size":"contracts"},"worst_case":{"attained":true,"pnl":"-4328.875","price":"60000"}}
