{"assumptions":["common_reference"],"baseline":{"kind":"explicit","label":"generated","price":"90000"},"checks_not_performed":["LIVE_EXECUTION","PATH_RISK"],"comparisons":{"no_hedge":{"failing_intervals":[],"proposal_better":[{"lower":"105000","lower_inclusive":false,"upper":"110000","upper_inclusive":true}],"proposal_worse":[{"lower":"60000","lower_inclusive":true,"upper":"105000","upper_inclusive":true}],"worst_case":{"pnl":"-3000","price":"60000"}},"smallest_reduction":{"keep_quantity":"0.1","proposal_better":[{"lower":"105000","lower_inclusive":false,"upper":"110000","upper_inclusive":true}],"proposal_worse":[{"lower":"60000","lower_inclusive":true,"upper":"105000","upper_inclusive":true}],"sell_at":"90000","sell_quantity":"0","worst_case":{"pnl":"-3000","price":"60000"}}},"cost":{"breakevens":["90929.8"],"other_costs":"5","pnl_at_baseline":"-92.98","premium":"87.98"},"engine_version":"reference-oracle-3","evaluation_scope":"exhaustive_supported_terminal_model","execution_readiness":"not_evaluated","failing_intervals":[{"clause":"clause_1","lower":"60000","lower_inclusive":true,"upper":"70919.8","upper_inclusive":false,"witness":{"adverse_states":[{"leg":"leg-1","rule":"unreviewed_family","state":"nothing is established about what the leg pays"},{"leg":"leg-2","rule":"unreviewed_family","state":"nothing is established about what the leg pays"}],"pnl":"-3092.98","price":"60000"}}],"ir_digest":"8e449d2caf6e0ee09261d051f810511a3fb74ccdd933960d4f158d5737084dce","leg_observation_times":["2026-09-19T06:00:00Z","2026-09-19T06:00:00Z","2026-09-19T06:00:00Z"],"model_result":"fails","objective_valuation_time":"2026-09-19T06:00:00Z","profile":[{"intercept":"-9092.98","lower":"60000","lower_inclusive":true,"slope":"0.1","upper":"105000","upper_inclusive":true},{"intercept":"-8992.98","lower":"105000","lower_inclusive":false,"slope":"0.1","upper":"110000","upper_inclusive":true}],"reason_codes":["LOSS_BOUND_EXCEEDED","UNREVIEWED_FAMILY"],"reductions":[{"leg":"leg-1","reason_code":"UNREVIEWED_FAMILY","rule":"unreviewed_family","tight":false},{"leg":"leg-2","reason_code":"UNREVIEWED_FAMILY","rule":"unreviewed_family","tight":false}],"schema_version":"1","snapshots":["aaaaaaaaaaaaaaaaaaaaaaaaaaaaaaaaaaaaaaaaaaaaaaaaaaaaaaaaaaaaaaaa"],"units":{"exposure":"BTC","money":"USDC","price":"USDC per BTC","size":"contracts"},"upper_profile":[{"intercept":"-9091.98","lower":"60000","lower_inclusive":true,"slope":"0.1","upper":"105000","upper_inclusive":true},{"intercept":"-8991.98","lower":"105000","lower_inclusive":false,"slope":"0.1","upper":"110000","upper_inclusive":true}],"worst_case":{"attained":true,"pnl":"-3092.98","price":"60000"}}
