{"assumptions":["common_reference"],"baseline":{"kind":"explicit","label":"generated","price":"70000"},"checks_not_performed":["LIVE_EXECUTION","PATH_RISK"],"comparisons":{"no_hedge":{"failing_intervals":[{"lower":"60000","lower_inclusive":true,"upper":"66000","upper_inclusive":false}],"proposal_better":[{"lower":"70000","lower_inclusive":true,"upper":"75908","upper_inclusive":true}],"proposal_worse":[{"lower":"60000","lower_inclusive":true,"upper":"70000","upper_inclusive":false},{"lower":"75908","lower_inclusive":false,"upper":"110000","upper_inclusive":true}],"worst_case":{"pnl":"-10000","price":"60000"}},"smallest_reduction":{"keep_quantity":"0.4","proposal_better":[{"lower":"70000","lower_inclusive":true,"upper":"110000","upper_inclusive":true}],"proposal_worse":[{"lower":"60000","lower_inclusive":true,"upper":"70000","upper_inclusive":false}],"sell_at":"70000","sell_quantity":"0.6","worst_case":{"pnl":"-4000","price":"60000"}}},"cost":{"breakevens":[],"other_costs":"25","pnl_at_baseline":"13.5","premium":"62.5"},"engine_version":"reference-oracle-3","evaluation_scope":"exhaustive_supported_terminal_model","execution_readiness":"not_evaluated","failing_intervals":[{"clause":"clause_1","lower":"60000","lower_inclusive":true,"upper":"69086.5","upper_inclusive":false,"witness":{"pnl":"-10087.5","price":"60000"}}],"ir_digest":"d901c99815a71422d2421bbfdda67088f85da577856a9b5d87a28aa1feeb7535","leg_observation_times":["2026-09-19T06:00:00Z","2026-09-19T06:00:00Z"],"model_result":"fails","objective_valuation_time":"2026-09-19T06:00:00Z","profile":[{"intercept":"-10087.5","lower":"60000","lower_inclusive":true,"slope":"0","upper":"60000","upper_inclusive":true},{"intercept":"-70086.5","lower":"60000","lower_inclusive":false,"slope":"1","upper":"70000","upper_inclusive":false},{"intercept":"-69986.5","lower":"70000","lower_inclusive":true,"slope":"1","upper":"75908","upper_inclusive":true},{"intercept":"-70086.5","lower":"75908","lower_inclusive":false,"slope":"1","upper":"110000","upper_inclusive":true}],"reason_codes":["LOSS_BOUND_EXCEEDED"],"schema_version":"1","snapshots":[],"units":{"exposure":"BTC","money":"USDC","price":"USDC per BTC","size":"contracts"},"worst_case":{"attained":true,"pnl":"-10087.5","price":"60000"}}
