{"assumptions":["common_reference"],"baseline":{"kind":"explicit","label":"generated","price":"70000"},"checks_not_performed":["LIVE_EXECUTION","PATH_RISK"],"comparisons":{"no_hedge":{"failing_intervals":[{"lower":"60000","lower_inclusive":true,"upper":"62000","upper_inclusive":false}],"proposal_better":[],"proposal_worse":[{"lower":"60000","lower_inclusive":true,"upper":"110000","upper_inclusive":true}],"worst_case":{"pnl":"-10000","price":"60000"}},"smallest_reduction":{"keep_quantity":"0.8","proposal_better":[{"lower":"72437.3","lower_inclusive":false,"upper":"110000","upper_inclusive":true}],"proposal_worse":[{"lower":"60000","lower_inclusive":true,"upper":"72437.3","upper_inclusive":false}],"sell_at":"70000","sell_quantity":"0.2","worst_case":{"pnl":"-8000","price":"60000"}}},"cost":{"breakevens":["70487.46"],"other_costs":"25","pnl_at_baseline":"-487.46","premium":"462.46"},"engine_version":"reference-oracle-3","evaluation_scope":"exhaustive_supported_terminal_model","execution_readiness":"not_evaluated","failing_intervals":[{"clause":"clause_0","lower":"60000","lower_inclusive":true,"upper":"68577.46","upper_inclusive":false,"witness":{"adverse_states":[{"leg":"leg-1","rule":"unreviewed_family","state":"nothing is established about what the leg pays"},{"leg":"leg-2","rule":"unreviewed_family","state":"nothing is established about what the leg pays"}],"pnl":"-10487.46","price":"60000"}},{"clause":"clause_2","lower":"60000","lower_inclusive":true,"upper":"65077.46","upper_inclusive":false,"witness":{"adverse_states":[{"leg":"leg-1","rule":"unreviewed_family","state":"nothing is established about what the leg pays"},{"leg":"leg-2","rule":"unreviewed_family","state":"nothing is established about what the leg pays"}],"pnl":"-10487.46","price":"60000"}}],"ir_digest":"7764764ee61a7d7e123e7528f8917ecf7133b6d422608b851e00754569cb23f7","leg_observation_times":["2026-09-19T06:00:00Z","2026-09-19T06:00:00Z","2026-09-19T06:00:00Z"],"model_result":"fails","objective_valuation_time":"2026-09-19T06:00:00Z","profile":[{"intercept":"-70487.46","lower":"60000","lower_inclusive":true,"slope":"1","upper":"110000","upper_inclusive":true}],"reason_codes":["LOSS_BOUND_EXCEEDED","UNREVIEWED_FAMILY"],"reductions":[{"leg":"leg-1","reason_code":"UNREVIEWED_FAMILY","rule":"unreviewed_family","tight":false},{"leg":"leg-2","reason_code":"UNREVIEWED_FAMILY","rule":"unreviewed_family","tight":false}],"schema_version":"1","snapshots":[],"units":{"exposure":"BTC","money":"USDC","price":"USDC per BTC","size":"contracts"},"upper_profile":[{"intercept":"-69077.46","lower":"60000","lower_inclusive":true,"slope":"1","upper":"110000","upper_inclusive":true}],"worst_case":{"attained":true,"pnl":"-10487.46","price":"60000"}}
