{"assumptions":["common_reference"],"baseline":{"kind":"explicit","label":"generated","price":"70000"},"checks_not_performed":["LIVE_EXECUTION","PATH_RISK"],"comparisons":{"no_hedge":{"failing_intervals":[],"proposal_better":[],"proposal_worse":[{"lower":"60000","lower_inclusive":true,"upper":"110000","upper_inclusive":true}],"worst_case":{"pnl":"0","price":"60000"}},"smallest_reduction":{"keep_quantity":"0","proposal_better":[],"proposal_worse":[{"lower":"60000","lower_inclusive":true,"upper":"110000","upper_inclusive":true}],"sell_at":"70000","sell_quantity":"0","worst_case":{"pnl":"0","price":"60000"}}},"cost":{"breakevens":[],"other_costs":"25","pnl_at_baseline":"-1007.36591","premium":"2392.36591"},"engine_version":"reference-oracle-3","evaluation_scope":"exhaustive_supported_terminal_model","execution_readiness":"not_evaluated","failing_intervals":[{"clause":"clause_0","lower":"75908","lower_inclusive":true,"upper":"110000","upper_inclusive":true,"witness":{"adverse_states":[{"leg":"leg-0","rule":"unreviewed_family","state":"nothing is established about what the leg pays"}],"pnl":"-2417.36591","price":"105000"}},{"clause":"clause_1","lower":"75908","lower_inclusive":true,"upper":"110000","upper_inclusive":true,"witness":{"adverse_states":[{"leg":"leg-0","rule":"unreviewed_family","state":"nothing is established about what the leg pays"}],"pnl":"-2417.36591","price":"105000"}}],"ir_digest":"9ec930d0b01cc0e2fc4a23b4842c74efa540dc4aa0ada2ce87b8b3dc3c37ef92","leg_observation_times":["2026-09-19T06:00:00Z","2026-09-19T06:00:00Z","2026-09-19T06:00:00Z"],"model_result":"fails","objective_valuation_time":"2026-09-19T06:00:00Z","profile":[{"intercept":"-1008.36591","lower":"60000","lower_inclusive":true,"slope":"0","upper":"70000","upper_inclusive":false},{"intercept":"-1007.36591","lower":"70000","lower_inclusive":true,"slope":"0","upper":"75908","upper_inclusive":false},{"intercept":"-2416.36591","lower":"75908","lower_inclusive":true,"slope":"0","upper":"105000","upper_inclusive":false},{"intercept":"-2417.36591","lower":"105000","lower_inclusive":true,"slope":"0","upper":"110000","upper_inclusive":true}],"reason_codes":["LOSS_BOUND_EXCEEDED","UNREVIEWED_FAMILY"],"reductions":[{"leg":"leg-0","reason_code":"UNREVIEWED_FAMILY","rule":"unreviewed_family","tight":false}],"schema_version":"1","snapshots":["aaaaaaaaaaaaaaaaaaaaaaaaaaaaaaaaaaaaaaaaaaaaaaaaaaaaaaaaaaaaaaaa"],"units":{"exposure":"BTC","money":"USDC","price":"USDC per BTC","size":"contracts"},"upper_profile":[{"intercept":"400.63409","lower":"60000","lower_inclusive":true,"slope":"0","upper":"70000","upper_inclusive":false},{"intercept":"401.63409","lower":"70000","lower_inclusive":true,"slope":"0","upper":"75908","upper_inclusive":false},{"intercept":"-1007.36591","lower":"75908","lower_inclusive":true,"slope":"0","upper":"105000","upper_inclusive":false},{"intercept":"-1008.36591","lower":"105000","lower_inclusive":true,"slope":"0","upper":"110000","upper_inclusive":true}],"worst_case":{"attained":true,"pnl":"-2417.36591","price":"105000"}}
