{"assumptions":["common_reference"],"baseline":{"kind":"explicit","label":"generated","price":"75908"},"checks_not_performed":["LIVE_EXECUTION","PATH_RISK"],"comparisons":{"no_hedge":{"failing_intervals":[{"lower":"60000","lower_inclusive":true,"upper":"65908","upper_inclusive":false}],"proposal_better":[],"proposal_worse":[{"lower":"60000","lower_inclusive":true,"upper":"110000","upper_inclusive":true}],"worst_case":{"pnl":"-1590.8","price":"60000"}},"smallest_reduction":{"keep_quantity":"250/3977","proposal_better":[{"lower":"132199966/1477","lower_inclusive":false,"upper":"110000","upper_inclusive":true}],"proposal_worse":[{"lower":"60000","lower_inclusive":true,"upper":"132199966/1477","upper_inclusive":false}],"sell_at":"75908","sell_quantity":"1477/39770","worst_case":{"pnl":"-1000","price":"60000"}}},"cost":{"breakevens":["80958"],"other_costs":"5","pnl_at_baseline":"-505","premium":"500"},"engine_version":"reference-oracle-3","evaluation_scope":"exhaustive_supported_terminal_model","execution_readiness":"not_evaluated","failing_intervals":[{"clause":"clause_1","lower":"60000","lower_inclusive":true,"upper":"70958","upper_inclusive":false,"witness":{"adverse_states":[{"leg":"leg-0","rule":"horizon_mismatch","state":"the leg's own observation pays zero"}],"pnl":"-2095.8","price":"60000"}},{"clause":"clause_2","lower":"60000","lower_inclusive":true,"upper":"75958","upper_inclusive":false,"witness":{"adverse_states":[{"leg":"leg-0","rule":"horizon_mismatch","state":"the leg's own observation pays zero"}],"pnl":"-2095.8","price":"60000"}}],"ir_digest":"91ec4c7597e2ecdc935d6fa942828193e16b36d715cadeb64fb30abdcd6840cb","leg_observation_times":["2026-09-20T06:00:00Z"],"model_result":"fails","objective_valuation_time":"2026-09-19T06:00:00Z","profile":[{"intercept":"-8095.8","lower":"60000","lower_inclusive":true,"slope":"0.1","upper":"110000","upper_inclusive":true}],"reason_codes":["LEG_WORST_CASED_HORIZON","LOSS_BOUND_EXCEEDED"],"reductions":[{"leg":"leg-0","reason_code":"LEG_WORST_CASED_HORIZON","rule":"horizon_mismatch","tight":true}],"schema_version":"1","snapshots":[],"units":{"exposure":"BTC","money":"USDC","price":"USDC per BTC","size":"contracts"},"upper_profile":[{"intercept":"-6095.8","lower":"60000","lower_inclusive":true,"slope":"0.1","upper":"110000","upper_inclusive":true}],"worst_case":{"attained":true,"pnl":"-2095.8","price":"60000"}}
