{"assumptions":["common_reference"],"baseline":{"kind":"explicit","label":"generated","price":"110000"},"checks_not_performed":["LIVE_EXECUTION","PATH_RISK"],"comparisons":{"no_hedge":{"failing_intervals":[{"lower":"60000","lower_inclusive":true,"upper":"109000","upper_inclusive":false}],"proposal_better":[],"proposal_worse":[{"lower":"60000","lower_inclusive":true,"upper":"110000","upper_inclusive":true}],"worst_case":{"pnl":"-50000","price":"60000"}},"smallest_reduction":{"keep_quantity":"0.02","proposal_better":[],"proposal_worse":[{"lower":"60000","lower_inclusive":true,"upper":"110000","upper_inclusive":true}],"sell_at":"110000","sell_quantity":"0.98","worst_case":{"pnl":"-1000","price":"60000"}}},"cost":{"breakevens":[],"other_costs":"0","pnl_at_baseline":"-938.94","premium":"938.94"},"engine_version":"reference-oracle-3","evaluation_scope":"exhaustive_supported_terminal_model","execution_readiness":"not_evaluated","failing_intervals":[{"clause":"clause_0","lower":"60000","lower_inclusive":true,"upper":"107166.94","upper_inclusive":false,"witness":{"adverse_states":[{"leg":"leg-0","rule":"horizon_mismatch","state":"the leg's own observation pays zero"},{"leg":"leg-2","rule":"unreviewed_family","state":"nothing is established about what the leg pays"},{"leg":"leg-3","rule":"unreviewed_family","state":"nothing is established about what the leg pays"}],"pnl":"-50838.94","price":"60000"}},{"clause":"clause_1","lower":"65000","lower_inclusive":true,"upper":"107166.94","upper_inclusive":false,"witness":{"adverse_states":[{"leg":"leg-0","rule":"horizon_mismatch","state":"the leg's own observation pays zero"},{"leg":"leg-2","rule":"unreviewed_family","state":"nothing is established about what the leg pays"},{"leg":"leg-3","rule":"unreviewed_family","state":"nothing is established about what the leg pays"}],"pnl":"-45838.94","price":"65000"}}],"ir_digest":"69ba8253866a703998cd1acc7c9d123d0fdaa643e12d128b4c2852ce89c1041f","leg_observation_times":["2026-09-20T06:00:00Z","2026-09-19T06:00:00Z","2026-09-19T06:00:00Z","2026-09-19T06:00:00Z"],"model_result":"fails","objective_valuation_time":"2026-09-19T06:00:00Z","profile":[{"intercept":"-110838.94","lower":"60000","lower_inclusive":true,"slope":"1","upper":"85000","upper_inclusive":false},{"intercept":"-110938.94","lower":"85000","lower_inclusive":true,"slope":"1","upper":"110000","upper_inclusive":true}],"reason_codes":["LEG_WORST_CASED_HORIZON","LOSS_BOUND_EXCEEDED","UNREVIEWED_FAMILY"],"reductions":[{"leg":"leg-0","reason_code":"LEG_WORST_CASED_HORIZON","rule":"horizon_mismatch","tight":true},{"leg":"leg-2","reason_code":"UNREVIEWED_FAMILY","rule":"unreviewed_family","tight":false},{"leg":"leg-3","reason_code":"UNREVIEWED_FAMILY","rule":"unreviewed_family","tight":false}],"schema_version":"1","snapshots":["aaaaaaaaaaaaaaaaaaaaaaaaaaaaaaaaaaaaaaaaaaaaaaaaaaaaaaaaaaaaaaaa"],"units":{"exposure":"BTC","money":"USDC","price":"USDC per BTC","size":"contracts"},"upper_profile":[{"intercept":"-108066.94","lower":"60000","lower_inclusive":true,"slope":"1","upper":"85000","upper_inclusive":false},{"intercept":"-108166.94","lower":"85000","lower_inclusive":true,"slope":"1","upper":"110000","upper_inclusive":true}],"worst_case":{"attained":true,"pnl":"-50838.94","price":"60000"}}
