{"assumptions":["common_reference"],"baseline":{"kind":"explicit","label":"generated","price":"90000"},"checks_not_performed":["LIVE_EXECUTION","PATH_RISK"],"comparisons":{"no_hedge":{"failing_intervals":[],"proposal_better":[{"lower":"60000","lower_inclusive":true,"upper":"110000","upper_inclusive":true}],"proposal_worse":[],"worst_case":{"pnl":"-3000","price":"60000"}},"smallest_reduction":{"keep_quantity":"0.1","proposal_better":[{"lower":"60000","lower_inclusive":true,"upper":"110000","upper_inclusive":true}],"proposal_worse":[],"sell_at":"90000","sell_quantity":"0","worst_case":{"pnl":"-3000","price":"60000"}}},"cost":{"breakevens":["80588.1"],"other_costs":"5","pnl_at_baseline":"941.19","premium":"1054.81"},"engine_version":"reference-oracle-3","evaluation_scope":"exhaustive_supported_terminal_model","execution_readiness":"not_evaluated","failing_intervals":[],"ir_digest":"52a9a4be66b62851a43c0c5a279d5b58324ae8440591e5cddec02c3c3a06f9ab","leg_observation_times":["2026-09-20T06:00:00Z","2026-09-19T06:00:00Z","2026-09-19T06:00:00Z"],"model_result":"passes","objective_valuation_time":"2026-09-19T06:00:00Z","profile":[{"intercept":"-8059.81","lower":"60000","lower_inclusive":true,"slope":"0.1","upper":"77457","upper_inclusive":false},{"intercept":"-8058.81","lower":"77457","lower_inclusive":true,"slope":"0.1","upper":"110000","upper_inclusive":true}],"reason_codes":["LEG_WORST_CASED_HORIZON"],"reductions":[{"leg":"leg-0","reason_code":"LEG_WORST_CASED_HORIZON","rule":"horizon_mismatch","tight":true}],"schema_version":"1","size_windows":[{"binding":[],"largest":"200100","leg":"leg-1","lower_bound":"0","smallest":"0","status":"nonempty","upper_bound":"200100"}],"snapshots":["aaaaaaaaaaaaaaaaaaaaaaaaaaaaaaaaaaaaaaaaaaaaaaaaaaaaaaaaaaaaaaaa"],"units":{"exposure":"BTC","money":"USDC","price":"USDC per BTC","size":"contracts"},"upper_profile":[{"intercept":"-7959.81","lower":"60000","lower_inclusive":true,"slope":"0.1","upper":"77457","upper_inclusive":false},{"intercept":"-7958.81","lower":"77457","lower_inclusive":true,"slope":"0.1","upper":"110000","upper_inclusive":true}],"worst_case":{"attained":true,"pnl":"-2059.81","price":"60000"}}
