{"assumptions":["common_reference"],"baseline":{"kind":"explicit","label":"generated","price":"100000"},"checks_not_performed":["LIVE_EXECUTION","PATH_RISK"],"comparisons":{"no_hedge":{"failing_intervals":[],"proposal_better":[{"lower":"75908","lower_inclusive":true,"upper":"110000","upper_inclusive":true}],"proposal_worse":[{"lower":"60000","lower_inclusive":true,"upper":"75908","upper_inclusive":false}],"worst_case":{"pnl":"-10000","price":"60000"}},"smallest_reduction":{"keep_quantity":"0.25","proposal_better":[{"lower":"75908","lower_inclusive":true,"upper":"110000","upper_inclusive":true}],"proposal_worse":[{"lower":"60000","lower_inclusive":true,"upper":"75908","upper_inclusive":false}],"sell_at":"100000","sell_quantity":"0","worst_case":{"pnl":"-10000","price":"60000"}}},"cost":{"breakevens":["99712.3"],"other_costs":"5","pnl_at_baseline":"71.925","premium":"23.075"},"engine_version":"reference-oracle-3","evaluation_scope":"exhaustive_supported_terminal_model","execution_readiness":"not_evaluated","failing_intervals":[{"clause":"clause_1","lower":"60000","lower_inclusive":true,"upper":"97708.3","upper_inclusive":false,"witness":{"adverse_states":[{"leg":"leg-3","rule":"unreviewed_family","state":"nothing is established about what the leg pays"}],"pnl":"-10026.075","price":"60000"}},{"clause":"clause_2","lower":"60000","lower_inclusive":true,"upper":"83708.3","upper_inclusive":false,"witness":{"adverse_states":[{"leg":"leg-3","rule":"unreviewed_family","state":"nothing is established about what the leg pays"}],"pnl":"-10026.075","price":"60000"}}],"ir_digest":"6ef8f8431b76c856f70d4a215ed48b1980c0046fa7cdb6d957c86739d3e94b9f","leg_observation_times":["2026-09-19T06:00:00Z","2026-09-19T06:00:00Z","2026-09-19T06:00:00Z","2026-09-19T06:00:00Z"],"model_result":"fails","objective_valuation_time":"2026-09-19T06:00:00Z","profile":[{"intercept":"-25026.075","lower":"60000","lower_inclusive":true,"slope":"0.25","upper":"70000","upper_inclusive":true},{"intercept":"-25027.075","lower":"70000","lower_inclusive":false,"slope":"0.25","upper":"75908","upper_inclusive":false},{"intercept":"-5950.075","lower":"75908","lower_inclusive":true,"slope":"0","upper":"75908","upper_inclusive":true},{"intercept":"-24928.075","lower":"75908","lower_inclusive":false,"slope":"0.25","upper":"110000","upper_inclusive":true}],"reason_codes":["LOSS_BOUND_EXCEEDED","UNREVIEWED_FAMILY"],"reductions":[{"leg":"leg-3","reason_code":"UNREVIEWED_FAMILY","rule":"unreviewed_family","tight":false}],"schema_version":"1","size_windows":[{"binding":[{"price":"75908","side":"above"}],"largest":"17079","leg":"leg-0","lower_bound":"0","smallest":"0","status":"nonempty","upper_bound":"1707934000/99999"},{"binding":[{"price":"60000","side":"at"}],"largest":"10746","leg":"leg-1","lower_bound":"0","smallest":"0","status":"nonempty","upper_bound":"1074591500/99999"}],"snapshots":["aaaaaaaaaaaaaaaaaaaaaaaaaaaaaaaaaaaaaaaaaaaaaaaaaaaaaaaaaaaaaaaa"],"units":{"exposure":"BTC","money":"USDC","price":"USDC per BTC","size":"contracts"},"upper_profile":[{"intercept":"-25025.075","lower":"60000","lower_inclusive":true,"slope":"0.25","upper":"70000","upper_inclusive":true},{"intercept":"-25026.075","lower":"70000","lower_inclusive":false,"slope":"0.25","upper":"75908","upper_inclusive":false},{"intercept":"-5949.075","lower":"75908","lower_inclusive":true,"slope":"0","upper":"75908","upper_inclusive":true},{"intercept":"-24927.075","lower":"75908","lower_inclusive":false,"slope":"0.25","upper":"110000","upper_inclusive":true}],"worst_case":{"attained":true,"pnl":"-10026.075","price":"60000"}}
