{"assumptions":["common_reference"],"baseline":{"kind":"explicit","label":"generated","price":"105000"},"checks_not_performed":["LIVE_EXECUTION","PATH_RISK"],"comparisons":{"no_hedge":{"failing_intervals":[{"lower":"60000","lower_inclusive":true,"upper":"101000","upper_inclusive":false}],"proposal_better":[],"proposal_worse":[{"lower":"60000","lower_inclusive":true,"upper":"110000","upper_inclusive":true}],"worst_case":{"pnl":"-11250","price":"60000"}},"smallest_reduction":{"keep_quantity":"1/45","proposal_better":[],"proposal_worse":[{"lower":"60000","lower_inclusive":true,"upper":"110000","upper_inclusive":true}],"sell_at":"105000","sell_quantity":"41/180","worst_case":{"pnl":"-1000","price":"60000"}}},"cost":{"breakevens":[],"other_costs":"0","pnl_at_baseline":"-2131","premium":"2231"},"engine_version":"reference-oracle-3","evaluation_scope":"exhaustive_supported_terminal_model","execution_readiness":"not_evaluated","failing_intervals":[{"clause":"clause_0","lower":"60000","lower_inclusive":true,"upper":"101524","upper_inclusive":false,"witness":{"adverse_states":[{"leg":"leg-3","rule":"unreviewed_family","state":"nothing is established about what the leg pays"}],"pnl":"-12557","price":"60000"}},{"clause":"clause_0","lower":"105000","lower_inclusive":true,"upper":"109524","upper_inclusive":false,"witness":{"adverse_states":[{"leg":"leg-3","rule":"unreviewed_family","state":"nothing is established about what the leg pays"}],"pnl":"-2131","price":"105000"}},{"clause":"clause_1","lower":"60000","lower_inclusive":true,"upper":"101524","upper_inclusive":false,"witness":{"adverse_states":[{"leg":"leg-3","rule":"unreviewed_family","state":"nothing is established about what the leg pays"}],"pnl":"-12557","price":"60000"}},{"clause":"clause_1","lower":"105000","lower_inclusive":true,"upper":"109524","upper_inclusive":false,"witness":{"adverse_states":[{"leg":"leg-3","rule":"unreviewed_family","state":"nothing is established about what the leg pays"}],"pnl":"-2131","price":"105000"}}],"ir_digest":"453cfd82172fc37ef3b31720e7b702a81dc124fdfba8b39d534f5ebd425195bf","leg_observation_times":["2026-09-19T06:00:00Z","2026-09-19T06:00:00Z","2026-09-19T06:00:00Z","2026-09-19T06:00:00Z"],"model_result":"fails","objective_valuation_time":"2026-09-19T06:00:00Z","profile":[{"intercept":"-27557","lower":"60000","lower_inclusive":true,"slope":"0.25","upper":"65000","upper_inclusive":false},{"intercept":"-28481","lower":"65000","lower_inclusive":true,"slope":"0.25","upper":"75908","upper_inclusive":true},{"intercept":"-28381","lower":"75908","lower_inclusive":false,"slope":"0.25","upper":"90000","upper_inclusive":true},{"intercept":"-26381","lower":"90000","lower_inclusive":false,"slope":"0.25","upper":"105000","upper_inclusive":false},{"intercept":"-28381","lower":"105000","lower_inclusive":true,"slope":"0.25","upper":"110000","upper_inclusive":true}],"reason_codes":["LOSS_BOUND_EXCEEDED","UNREVIEWED_FAMILY"],"reductions":[{"leg":"leg-3","reason_code":"UNREVIEWED_FAMILY","rule":"unreviewed_family","tight":false}],"schema_version":"1","snapshots":[],"units":{"exposure":"BTC","money":"USDC","price":"USDC per BTC","size":"contracts"},"upper_profile":[{"intercept":"-27557","lower":"60000","lower_inclusive":true,"slope":"0.25","upper":"65000","upper_inclusive":false},{"intercept":"-28481","lower":"65000","lower_inclusive":true,"slope":"0.25","upper":"75908","upper_inclusive":true},{"intercept":"-28381","lower":"75908","lower_inclusive":false,"slope":"0.25","upper":"90000","upper_inclusive":true},{"intercept":"-26381","lower":"90000","lower_inclusive":false,"slope":"0.25","upper":"105000","upper_inclusive":false},{"intercept":"-28381","lower":"105000","lower_inclusive":true,"slope":"0.25","upper":"110000","upper_inclusive":true}],"worst_case":{"attained":true,"pnl":"-12557","price":"60000"}}
