{"assumptions":["common_reference"],"baseline":{"kind":"explicit","label":"generated","price":"105000"},"checks_not_performed":["LIVE_EXECUTION","PATH_RISK"],"comparisons":{"no_hedge":{"failing_intervals":[{"lower":"60000","lower_inclusive":true,"upper":"73000","upper_inclusive":false}],"proposal_better":[],"proposal_worse":[{"lower":"60000","lower_inclusive":true,"upper":"110000","upper_inclusive":true}],"worst_case":{"pnl":"-11250","price":"60000"}},"smallest_reduction":{"keep_quantity":"8/45","proposal_better":[],"proposal_worse":[{"lower":"60000","lower_inclusive":true,"upper":"110000","upper_inclusive":true}],"sell_at":"105000","sell_quantity":"13/180","worst_case":{"pnl":"-8000","price":"60000"}}},"cost":{"breakevens":[],"other_costs":"0","pnl_at_baseline":"-3423.04","premium":"3423.04"},"engine_version":"reference-oracle-3","evaluation_scope":"exhaustive_supported_terminal_model","execution_readiness":"not_evaluated","failing_intervals":[{"clause":"clause_0","lower":"60000","lower_inclusive":true,"upper":"78292.16","upper_inclusive":false,"witness":{"adverse_states":[{"leg":"leg-0","rule":"unreviewed_family","state":"nothing is established about what the leg pays"},{"leg":"leg-3","rule":"unreviewed_family","state":"nothing is established about what the leg pays"}],"pnl":"-14673.04","price":"60000"}}],"ir_digest":"5f77110086f7985c9030b3b2f57afe8cd8ff73ce0c567bd7d663ce03318026ff","leg_observation_times":["2026-09-19T06:00:00Z","2026-09-19T06:00:00Z","2026-09-19T06:00:00Z","2026-09-19T06:00:00Z"],"model_result":"fails","objective_valuation_time":"2026-09-19T06:00:00Z","profile":[{"intercept":"-29673.04","lower":"60000","lower_inclusive":true,"slope":"0.25","upper":"77457","upper_inclusive":false},{"intercept":"-10208.79","lower":"77457","lower_inclusive":true,"slope":"0","upper":"77457","upper_inclusive":true},{"intercept":"-27573.04","lower":"77457","lower_inclusive":false,"slope":"0.25","upper":"85000","upper_inclusive":false},{"intercept":"-29573.04","lower":"85000","lower_inclusive":true,"slope":"0.25","upper":"90000","upper_inclusive":true},{"intercept":"-29673.04","lower":"90000","lower_inclusive":false,"slope":"0.25","upper":"110000","upper_inclusive":true}],"reason_codes":["LOSS_BOUND_EXCEEDED","UNREVIEWED_FAMILY"],"reductions":[{"leg":"leg-0","reason_code":"UNREVIEWED_FAMILY","rule":"unreviewed_family","tight":false},{"leg":"leg-3","reason_code":"UNREVIEWED_FAMILY","rule":"unreviewed_family","tight":false}],"schema_version":"1","snapshots":["aaaaaaaaaaaaaaaaaaaaaaaaaaaaaaaaaaaaaaaaaaaaaaaaaaaaaaaaaaaaaaaa"],"undecided_intervals":[{"clause":"clause_0","lower":"85000","lower_inclusive":true,"responsible_legs":["leg-0","leg-3"],"upper":"86292.16","upper_inclusive":false,"witness":{"pnl":"-8323.04","price":"85000"}}],"units":{"exposure":"BTC","money":"USDC","price":"USDC per BTC","size":"contracts"},"upper_profile":[{"intercept":"-26749.04","lower":"60000","lower_inclusive":true,"slope":"0.25","upper":"77457","upper_inclusive":false},{"intercept":"-7284.79","lower":"77457","lower_inclusive":true,"slope":"0","upper":"77457","upper_inclusive":true},{"intercept":"-24649.04","lower":"77457","lower_inclusive":false,"slope":"0.25","upper":"85000","upper_inclusive":false},{"intercept":"-26649.04","lower":"85000","lower_inclusive":true,"slope":"0.25","upper":"90000","upper_inclusive":true},{"intercept":"-26749.04","lower":"90000","lower_inclusive":false,"slope":"0.25","upper":"110000","upper_inclusive":true}],"worst_case":{"attained":true,"pnl":"-14673.04","price":"60000"}}
