{"assumptions":["common_reference"],"baseline":{"kind":"explicit","label":"generated","price":"85000"},"checks_not_performed":["LIVE_EXECUTION","PATH_RISK"],"comparisons":{"no_hedge":{"failing_intervals":[{"lower":"60000","lower_inclusive":true,"upper":"81000","upper_inclusive":false}],"proposal_better":[{"lower":"60000","lower_inclusive":true,"upper":"110000","upper_inclusive":true}],"proposal_worse":[],"worst_case":{"pnl":"-6250","price":"60000"}},"smallest_reduction":{"keep_quantity":"0.04","proposal_better":[{"lower":"1781000/21","lower_inclusive":false,"upper":"110000","upper_inclusive":true}],"proposal_worse":[{"lower":"60000","lower_inclusive":true,"upper":"1781000/21","upper_inclusive":false}],"sell_at":"85000","sell_quantity":"0.21","worst_case":{"pnl":"-1000","price":"60000"}}},"cost":{"breakevens":["84840"],"other_costs":"25","pnl_at_baseline":"40","premium":"35"},"engine_version":"reference-oracle-3","evaluation_scope":"exhaustive_supported_terminal_model","execution_readiness":"not_evaluated","failing_intervals":[{"clause":"clause_0","lower":"60000","lower_inclusive":true,"upper":"80840","upper_inclusive":false,"witness":{"pnl":"-6210","price":"60000"}}],"ir_digest":"6edaafa070f44c785e2e5d3fde28dbdc106c911cf729cecb2a1fecb72cc12b10","leg_observation_times":["2026-09-19T06:00:00Z"],"model_result":"fails","objective_valuation_time":"2026-09-19T06:00:00Z","profile":[{"intercept":"-21210","lower":"60000","lower_inclusive":true,"slope":"0.25","upper":"110000","upper_inclusive":true}],"reason_codes":["LOSS_BOUND_EXCEEDED"],"schema_version":"1","size_windows":[{"binding":[{"price":"60000","side":"at"}],"leg":"leg-0","status":"empty"}],"snapshots":["aaaaaaaaaaaaaaaaaaaaaaaaaaaaaaaaaaaaaaaaaaaaaaaaaaaaaaaaaaaaaaaa"],"units":{"exposure":"BTC","money":"USDC","price":"USDC per BTC","size":"contracts"},"worst_case":{"attained":true,"pnl":"-6210","price":"60000"}}
