{"assumptions":["common_reference"],"baseline":{"kind":"explicit","label":"generated","price":"75908"},"checks_not_performed":["LIVE_EXECUTION","PATH_RISK"],"comparisons":{"no_hedge":{"failing_intervals":[],"proposal_better":[{"lower":"60000","lower_inclusive":true,"upper":"105000","upper_inclusive":false}],"proposal_worse":[{"lower":"105000","lower_inclusive":true,"upper":"110000","upper_inclusive":true}],"worst_case":{"pnl":"-3977","price":"60000"}},"smallest_reduction":{"keep_quantity":"0.25","proposal_better":[{"lower":"60000","lower_inclusive":true,"upper":"105000","upper_inclusive":false}],"proposal_worse":[{"lower":"105000","lower_inclusive":true,"upper":"110000","upper_inclusive":true}],"sell_at":"75908","sell_quantity":"0","worst_case":{"pnl":"-3977","price":"60000"}}},"cost":{"breakevens":["71928"],"other_costs":"25","pnl_at_baseline":"995","premium":"980"},"engine_version":"reference-oracle-3","evaluation_scope":"exhaustive_supported_terminal_model","execution_readiness":"not_evaluated","failing_intervals":[],"ir_digest":"f486344426d56ef16d3312648baf6b8f20960595e4e2a5c67bb9df645e5b3bbb","leg_observation_times":["2026-09-19T06:00:00Z","2026-09-20T06:00:00Z","2026-09-19T06:00:00Z"],"model_result":"passes","objective_valuation_time":"2026-09-19T06:00:00Z","profile":[{"intercept":"-17982","lower":"60000","lower_inclusive":true,"slope":"0.25","upper":"105000","upper_inclusive":false},{"intercept":"-19982","lower":"105000","lower_inclusive":true,"slope":"0.25","upper":"110000","upper_inclusive":true}],"reason_codes":["LEG_WORST_CASED_HORIZON"],"reductions":[{"leg":"leg-1","reason_code":"LEG_WORST_CASED_HORIZON","rule":"horizon_mismatch","tight":true}],"schema_version":"1","size_windows":[{"binding":[{"price":"105000","side":"at"}],"largest":"28460","leg":"leg-0","lower_bound":"0","smallest":"0","status":"nonempty","upper_bound":"2845997600/99999"},{"binding":[{"price":"60000","side":"at"}],"largest":"38677","leg":"leg-2","lower_bound":"0","smallest":"0","status":"nonempty","upper_bound":"425450/11"}],"snapshots":["aaaaaaaaaaaaaaaaaaaaaaaaaaaaaaaaaaaaaaaaaaaaaaaaaaaaaaaaaaaaaaaa"],"units":{"exposure":"BTC","money":"USDC","price":"USDC per BTC","size":"contracts"},"upper_profile":[{"intercept":"-17982","lower":"60000","lower_inclusive":true,"slope":"0.25","upper":"105000","upper_inclusive":false},{"intercept":"-19982","lower":"105000","lower_inclusive":true,"slope":"0.25","upper":"110000","upper_inclusive":true}],"worst_case":{"attained":true,"pnl":"-2982","price":"60000"}}
