{"assumptions":["common_reference"],"baseline":{"kind":"explicit","label":"generated","price":"80000"},"checks_not_performed":["LIVE_EXECUTION","PATH_RISK"],"comparisons":{"no_hedge":{"failing_intervals":[{"lower":"60000","lower_inclusive":true,"upper":"64000","upper_inclusive":false}],"proposal_better":[],"proposal_worse":[{"lower":"60000","lower_inclusive":true,"upper":"110000","upper_inclusive":true}],"worst_case":{"pnl":"-5000","price":"60000"}},"smallest_reduction":{"keep_quantity":"0.2","proposal_better":[{"lower":"99619.6534","lower_inclusive":false,"upper":"110000","upper_inclusive":true}],"proposal_worse":[{"lower":"60000","lower_inclusive":true,"upper":"99619.6534","upper_inclusive":false}],"sell_at":"80000","sell_quantity":"0.05","worst_case":{"pnl":"-4000","price":"60000"}}},"cost":{"breakevens":["83923.93068"],"other_costs":"5","pnl_at_baseline":"-980.98267","premium":"1999.98267"},"engine_version":"reference-oracle-3","evaluation_scope":"exhaustive_supported_terminal_model","execution_readiness":"not_evaluated","failing_intervals":[],"ir_digest":"84c25e5efd582330dbb4262d71beb9ce8f909635274213b01c816f8213a7707a","leg_observation_times":["2026-09-19T06:00:00Z","2026-09-19T06:00:00Z","2026-09-19T06:00:00Z"],"model_result":"passes","objective_valuation_time":"2026-09-19T06:00:00Z","profile":[{"intercept":"-21080.98267","lower":"60000","lower_inclusive":true,"slope":"0.25","upper":"70000","upper_inclusive":false},{"intercept":"-20980.98267","lower":"70000","lower_inclusive":true,"slope":"0.25","upper":"110000","upper_inclusive":false},{"intercept":"6419.01733","lower":"110000","lower_inclusive":true,"slope":"0","upper":"110000","upper_inclusive":true}],"reason_codes":["UNREVIEWED_FAMILY"],"reductions":[{"leg":"leg-1","reason_code":"UNREVIEWED_FAMILY","rule":"unreviewed_family","tight":false}],"schema_version":"1","size_windows":[{"binding":[{"price":"60000","side":"at"}],"leg":"leg-0","status":"empty"},{"binding":[{"price":"60000","side":"at"}],"leg":"leg-2","status":"empty"}],"snapshots":["aaaaaaaaaaaaaaaaaaaaaaaaaaaaaaaaaaaaaaaaaaaaaaaaaaaaaaaaaaaaaaaa"],"units":{"exposure":"BTC","money":"USDC","price":"USDC per BTC","size":"contracts"},"upper_profile":[{"intercept":"-19671.98267","lower":"60000","lower_inclusive":true,"slope":"0.25","upper":"70000","upper_inclusive":false},{"intercept":"-19571.98267","lower":"70000","lower_inclusive":true,"slope":"0.25","upper":"110000","upper_inclusive":false},{"intercept":"7828.01733","lower":"110000","lower_inclusive":true,"slope":"0","upper":"110000","upper_inclusive":true}],"worst_case":{"attained":true,"pnl":"-6080.98267","price":"60000"}}
